2003,"20h10 pétantes",Plage du Noga-Hilton Cannes Alpes-Maritimes 
1978,"All Creatures Great and Small",Simonstone Hall Simonstone Hawes North Yorkshire England 
1956,"Assignment Foreign Legion",Beaconsfield Studios Beaconsfield Buckinghamshire England 
2015,"Backstrom",Allied Shipyard North Vancouver British Columbia 
2010,"Boardwalk Empire",Catalpa Avenue Ridgewood Queens New York City New York 
2012,"Cannes Eco 2012",Cannes Film Festival Cannes Alpes-Maritimes 
2014,"CockTales",Independent Dance Company Hollywood Los Angeles California 
2012,"DNOiSE Street Marketing",Málaga Málaga Andalucía 
1958,"Dotto",CBS-TV Manhattan New York City New York 
2000,"Eugenie Sandler P.I.",Altona Melbourne Victoria 
2014,"Every Street United",Rio de Janeiro Rio de Janeiro 
2010,"Fashion Beat TV",Roskilde Festival Roskilde Sjælland 
1996,"Fox Report w/ Shepard Smith",Fox News NY Studios - 48th Street & 6th Avenue Manhattan New York City New York 
2013,"Friendly Advice",North Hollywood Los Angeles California 
1955,"Front Row Center",Hollywood Los Angeles California 
2001,"HippHipp!",The Great Pyramids Giza Plateau Giza 
2009,"Horne & Corden",Inglis Barracks Mill Hill London England 
2012,"Hyperlinked",Loyola Marymount University - 1 LMU Drive Westchester Los Angeles California 
2002,"In-Laws",Hollywood Los Angeles California 
1980,"Juliet Bravo",Bacup Police Station Bank Street Bacup Lancashire England 
1999,"La gran ilusión",Dénia Alicante Comunitat Valenciana 
2015,"La vecina",Televisa San Angel Mexico City Distrito Federal 
2013,"Learning with Ghost Scott",Belfast County Antrim Northern Ireland 
1979,"Life on Earth",Brasília Zoo Brasília Distrito Federal 
1993,"London Tonight",ITN Gray's Inn Road Holborn London England 
2003,"Loves Me, Loves Me Not",Victoria 
2010,"Nikita",Revival 629 629 Eastern Avenue Toronto Ontario 
2008,"Noho, PA",New York City New York 
1961,"Number Please",Ritz Theater - 219 W. 48th Street Manhattan New York City New York 
2010,"Peripheral City",Brooklyn New York City New York 
1958,"Play Your Hunch",Studio 6B NBC Studios - 30 Rockefeller Plaza Manhattan New York City New York 
2000,"Real Rooms",Clifton Bristol England 
1998,"Russell Grant's Postcards",Hereford Herefordshire England 
2012,"Servers",Lower East Side Manhattan New York City New York 
2002,"Sjælen på vrangen",Hvidovre Hospital Hvidovre Sjælland 
2014,"Snow, Sex & Suspicious Parents",Savoie 
2005,"Talent Showcase",East Hampton Long Island New York 
1946,"Teen Canteen",Scotia Teen Canteen Schenectady New York 
2000,"The 10th Kingdom",Frensham Little Pond Farnham Surrey England 
2006,"The Amazing Race Asia",Sunny International Spice Shop Gadodia Market Khari Baoli Road Fatehpuri Old Delhi Central Delhi Delhi 
2001,"The Amazing Race",Centro Cívico San Carlos de Bariloche Río Negro 
2001,"The Amazing Race",Stazione Ferroviaría di Calalzo Via della Stazione 34 Calalzo di Cadore Belluno Veneto 
1970,"The Bold Ones: The Senator",Universal Studios - 100 Universal City Plaza Universal City California 
1956,"The Brothers",RKO Studios - 780 Gower Street Hollywood Los Angeles California 
1988,"The Kids in the Hall",CBC Studios Toronto Ontario 
1995,"The Politician's Wife",Pearl Assurance Building High Holborn Holborn London England 
1983,"The Winds of War",Park Lane Hotel Piccadilly London England 
1994,"Time Team",Merton London England 
1999,"WWF SmackDown!",Oakland-Alameda County Arena - 7000 Coliseum Way Oakland California 
2005,"Watch This!",Hollywood Los Angeles California 
1998,"World Impact with Billy Wilson",Edinburgh Castle Edinburgh Scotland 
2010,"Xtreme Tourist",Cancún Benito Juárez Quintana Roo 
1997,...Aur Pyaar Ho Gaya,Merlion Sentosa Southern Islands 
2004,100,000,000 Bon Jovi Fans Can't Be Wrong,100 000 Atlantic City New Jersey 
1897,13th Infantry, U.S. Army Marching Through Sallyport, Governors Island,13th Infantry U.S. Army Marching Through Sallyport New York Harbor New York City New York 
1963,1963 Cotton Bowl,Cotton Bowl - 3750 Midway Plaza Dallas Texas 
1989,1989 Holiday Bowl,Qualcomm Stadium San Diego California 
2016,2016 R+L Carriers New Orleans Bowl,Superdome - 1500 Poydras Street New Orleans Louisiana 
2002,28 Days Later...,Canary Wharf Underground Station Canary Wharf Isle of Dogs London England 
2009,3 Idiots,Woodville Palace Hotel Shimla Himachal Pradesh 
2015,30,000 Days,30 New York 
2006,38è Premi d'Honor de les Lletres Catalanes,Palau de la Música Catalana Barcelona Catalonia 
1976,40 gradi all'ombra del lenzuolo,Faenza Ravenna Emilia-Romagna 
2016,A College Student,2200 Benjamin Franklin Parkway Philadelphia Pennsylvania 
2010,A Gang Land Love Story,Hollywood Los Angeles California 
1956,A Kiss Before Dying,Sentinel Peak Tucson Arizona 
1915,A Night Out,Alcantara Building San Jose California 
2016,A Silent Scream,Oswaldstraße 17 Gelsenkirchen Northrhine-Westphalia 
1959,A Summer Place,Stage 6 Warner Brothers Burbank Studios - 4000 Warner Boulevard Burbank California 
1965,A Thousand Clowns,South Street Seaport - 19 Fulton Street Manhattan New York City New York 
1985,A View to a Kill,Fisherman's Wharf San Francisco California 
1976,A Whale of a Tale,Marineland of the Pacific - 6610 Palos Verdes Drive South Rancho Palos Verdes California 
2012,ASU School of International Letters & Cultures 2013 Recruitment Video,Barrett The Honors College ASU Tempe Arizona 
1955,Accadde al penitenziario,Fontana di Trevi Rome Lazio 
1999,Alexandra - Die Legende einer Sängerin,Baldurstraße Nymphenburg Munich Bavaria 
1979,All That Jazz,Kaufman Astoria Studios - 3412 36th Street Astoria Queens New York City New York 
1976,All the President's Men,City Hall - 200 N. Spring Street Downtown Los Angeles California 
2017,Allen & Tom,Ocaña Toledo Castilla-La Mancha 
2006,Amazing Grace,Blandford Dorset England 
1924,America,Shirley Plantation - 501 Shirley Plantation Road Charles City Virginia 
2001,American Pie 2,Shalom Institute - 34342 Mulholland Highway Malibu California 
1958,Ana dice sí,San Feliu de Guixols Girona Catalonia 
2000,And Ya Don't Stop: Hip Hop's Greatest Videos, Vol. 1,And Ya Don't Stop: Hip Hop's Greatest Videos California 
2017,Another Dirty Room 6: Shock Motel, Return to the Royal Inn Maryland,Another Dirty Room 6: Shock Motel Maryland 
1934,Apples to You!,Hal Roach Studios - 8822 Washington Blvd. Culver City California 
2008,Arkitektene,Konnerud Hill Minen Drammen Buskerud 
1937,Artists & Models,Paramount Studios - 5555 Melrose Avenue Hollywood Los Angeles California 
2015,Assassinista,127 US-206 Trenton New Jersey 
2007,Audition,Dreamland Loft Los Angeles California 
1971,Aunque la hormona se vista de seda...,Gandía Valencia Comunidad Valenciana 
1987,Baby Boom,375 Park Avenue & E 52nd Street New York City New York 
1984,Bachelor Party,John Marshall High School - 3939 Tracy Street Los Feliz Los Angeles California 
2014,Badass,Manchester Greater Manchester England 
1941,Ball of Fire,Samuel Goldwyn Studios - 7200 Santa Monica Boulevard West Hollywood California 
2010,Baptizing a Drunk,Lake Temescal Oakland California 
1987,Barfly,Royal Palms Recovery Home 360 S Westlake Ave Los Angeles California 
1995,Batman Forever,Lobby Surrogate's Court - 31 Chamber's Street Lower Manhattan Manhattan New York City New York 
1964,Bedtime Story,Train Station Backlot Universal Studios - 100 Universal City Plaza Universal City California 
1995,Before Sunrise,Riesenrad Prater Vienna 
2017,Behind the Scenes on the Road to Portland,Cincinnati Ohio 
2014,Beneath a Neon Tide,Hemsby Norfolk England 
2013,Bereullin,Namyangju Studio Complex Yangsuri Gyeonggi-do 
2011,Best Player,Heritage Woods Secondary School Port Moody British Columbia 
2016,Better,2636 Crenshaw Blvd Los Angeles California 
2010,Big Mouth,Porthcothan Cornwall England 
1986,Biggles,Holdenby House Holdenby Northamptonshire England 
2010,Bill Cunningham New York,The New York Times - 620 Eighth Avenue New York City New York 
2015,Billy the Kid,Oxford Oxfordshire England 
2002,Bitter Sweet,Falmouth Cornwall England 
1994,Blown Away,Joy Street Boston Massachusetts 
2003,Bocuse d'Or: A Chef's Dream,Lyon Rhône Rhône-Alpes 
1902,Bombardment of Newport,Fishers Island Long Island New York 
2016,Bonds Movie,Watson Grove Woods Loganville Georgia 
1992,Bossanova Blues,Blackpool Lancashire England 
2013,Boy,AROS Aarhus Jylland 
1975,Brannigan,Tower Bridge London England 
1983,Breathless,University of California Berkeley California 
1998,Bride of Chucky,45 Parliament Street Toronto Ontario 
1957,Brooklyn Goes to Detroit,Cadillac Square Detroit Michigan 
2005,Brothers of the Head,Barningham Hall Norfolk England 
2011,Brutt,Long Island City Queens New York City New York 
1991,Buttman's European Vacation,Hotel Barbizon Palace Amsterdam Noord-Holland 
2015,Calming Dysphoria,Harvard University Cambridge Massachusetts 
1943,Canal grande,Cinecittà Studios Cinecittà Rome Lazio 
2016,Carillion CDS Promotional Feature,Wolverhampton West Midlands England 
1928,Carry on, Sergeant!,Carry on Ontario 
1952,Casque d'or,Quartier de la Goutte d'Or Paris 18 Paris 
2007,Catwalk Dogs,Teddington Middlesex England 
1986,Chameli Ki Shaadi,Mehboob Studios Mumbai Maharashtra 
2008,Christina Aguilera: Back to Basics - Live and Down Under,Adelaide Entertainment Centre - 98 Port Road Hindmarsh South Australia 
2005,Coach Carter,1433 West 7th Street Los Angeles California 
1974,Come Fly with Us,JFK International Airport Jamaica Queens New York City New York 
2014,Como me enseñaron las películas,Sevilla Sevilla Andalucía 
2012,Contra el tiempo,Málaga Málaga Andalucía 
1958,Costa Blanca,Castillo de Oliva castle Oliva Valencia Comunidad Valenciana 
1990,Cross Fire,Central Junior High School Lawrence Kansas 
1988,Da,Ardmore Studios Herbert Road Bray County Wicklow 
2006,Daddy's Girl,Cardiff Royal Infirmary Cardiff South Glamorgan Wales 
2013,Damn You, Ping Pong!,Damn You Viseu de Mijloc Maramures 
1959,Danger Within,Chobham Common Surrey England 
1959,Das indische Grabmal,Lake Pichola Udaipur Rajasthan 
2009,David Guetta Feat. Kelly Rowland: When Love Takes Over,Venice Beach Los Angeles California 
2000,Day Return,Liverpool Merseyside England 
1971,De mar a mar por los Pirineos,Isla de los Faisanes Guipúzcoa País Vasco 
2004,De-Lovely,Chiswick House Burlington Lane Chiswick London England 
1981,Dead Ringer,Manhattan New York City New York 
1986,Defence of the Realm,Haddenham Buckinghamshire England 
1993,Der Kinoerzähler,Babelsberg Potsdam Brandenburg 
2013,Der Passagier,Stölln Gollenberg Brandenburg 
2000,Dhaai Akshar Prem Ke,Filmistan Studios Mumbai Maharashtra 
1997,Didier,Aéroport Montpellier-Méditerranée Mauguio Hérault 
2004,Die Walküre,Staatsoper Stuttgart Baden-Württemberg 
2005,Dirty,Hollywood Boulevard & Vine Street Hollywood Los Angeles California 
2007,Dlaczego nie!,Freta New Town Sródmiescie Warsaw Mazowieckie 
2013,Doctor Who: El Mundo Imperfecto,Barcelona Barcelona Catalonia 
1959,Don't Panic Chaps,Walton Studios Walton-on-Thames Surrey England 
1999,Double Jeopardy,Vancouver Public Library 360 West Georgia Street Vancouver British Columbia 
1968,Dr. Satán y la magia negra,Iztapalapa Mexico City Distrito Federal 
1942,Drei tolle Mädels,Centro Sperimentale di Cinematografia Rome Lazio 
1999,Drive Me Crazy,Foothill Boulevard Salt Lake City Utah 
1973,Dronningens nytårstale,Christian 9.s palæ Amalienborg Copenhagen 
1995,Dushmani: A Violent Love Story,Filmistan Studios Mumbai Maharashtra 
1970,E.M. Forster 1879-1970,Cambridge Cambridgeshire England 
2013,Eclosión y evolución del fanzine de genero en España,Zaragoza Zaragoza Aragón 
1988,Ek Hi Maqsad,Film City Goregaon Mumbai Maharashtra 
1991,El gran reto - Lola la Trailera 3,Ensenada Airport Ensenada Baja California 
2008,Elliot's War,Sonoma Coast Sonoma County California 
1957,Enchanted Isles,Oban Argyll and Bute Scotland 
2002,Epiphany: Il inferno,Bellevue Hospital - 462 First Avenue Manhattan New York City New York 
1964,Ercole contro i figli del sole,Elios Studios Rome Lazio 
1997,Event Horizon,Pinewood Studios Iver Heath Buckinghamshire England 
2007,Expresso,Waseley Hills Country Park Worcestershire England 
2008,Extreme Mind-Blowing Hotels,Lizzie Borden Bed & Breakfast Fall River Massachusetts 
2004,Fakers,Three Mills Studios Three Mill Lane Bow London England 
2006,Fanaa,Surajkund Gorakhpur Uttar Pradesh 
1991,Father of the Bride,Cheval Bistro 41 South Delacy Street Pasadena California 
1999,Felicia's Journey,Birmingham West Midlands England Cinema and Theatre 
1982,Festival of Mask,Hancock Park Los Angeles California 
1998,Field of Bones,Belfast County Antrim Northern Ireland 
2018,Fight 4 Your Life,Confidential Evaluations - Back Lot Sacramento California 
2016,Fin de semana,Zárate Buenos Aires Federal District 
1981,First Monday in October,Russell Senate Office Building - 100 Constitution Avenue Northeast Washington District of Columbia 
1941,Flying Cadets,Glendale Railroad Station 400 W. Cerritos Ave. Glendale California 
1972,Follow Me!,Sutton Place Guildford Surrey England 
2015,Fools Gold,Torquay Devon England 
1981,For Your Eyes Only,Paleokastritsa Road Bouas-Danilia Village Corfu 
2017,Fox Pointe,Old Zoo Griffith Park - 4730 Crystal Springs Drive Los Angeles California 
1972,Fratello sole, sorella luna,Fratello sole Rome Lazio 
2009,Friday the 13th,1370 Chestnut Street Bastrop Texas 
1987,Full Metal Jacket,Beckton Gasworks Beckton London England 
1989,Gangs, Cops & Drugs,Gangs California 
1905,Garland Dance, Vevey Fete,Garland Dance Canton de Vaud 
1976,Gator,River Street Savannah Georgia 
1980,Gefangene Frauen,Sonnenberg Zürich Kanton Zürich 
1966,Georgy Girl,Rosslyn Hill Hampstead London England 
1971,Get Carter,High Level Bridge Newcastle-upon-Tyne Tyne & Wear England 
1936,Girl of the Ozarks,Big Bear Lake Big Bear Valley San Bernardino National Forest California 
1941,Glimpses of Kentucky,Frankfort Cemetery - 215 E. Main Street Frankfort Kentucky 
1961,Goodbye Again,Quai Saint-Michel Paris 5 Paris 
2005,Green River Killer,Pacific Palisades Los Angeles California 
2009,Grey Gardens,Valley Halla Estate Rouge Park Toronto Ontario 
2009,Habibi,Manhattan New York City New York 
2004,Haletudsen,Flyvestation Værløse Værløse Sjælland 
1978,Halloween,The Frame Shop - 964 Mission Street South Pasadena California 
1967,Hamburg im Lincoln Center,Lincoln Center - 10 Lincoln Center Plaza Manhattan New York City New York 
2002,Hansel & Gretel,Warner Brothers Burbank Studios - 4000 Warner Boulevard Burbank California 
2013,Happy Family,Chinatown Manhattan New York City New York 
1998,Hard,El Portal Theatre - 5269 Lankershim Boulevard North Hollywood Los Angeles California in beginning of film 
2016,Hardwell: Run Wild,Ronda Málaga Andalucía 
2015,Harry & Snowman,Nederland Farm Dyke Virginia 
1897,Head of Procession Including Bluejackets,Westminster Bridge Westminster London England 
2009,Heartless,East London London England 
1997,Heaven's Burning,St. Vincent Street Port Adelaide South Australia 
2009,Hellraiser: Deader - Winter's Lament,Mount Sinai Long Island New York 
2015,Here and After,North Carolina Transportation Museum Spencer North Carolina 
2005,High Midnight,Hollywood Los Angeles California 
2009,Highly Confidential,Greenpoint Brooklyn New York City New York 
1971,Historia de una chica sola,Esplugues de Llobregat Barcelona Catalonia 
1965,Hollywood My Home Town,Warner Brothers Studios - 5800 Sunset Blvd. Hollywood Los Angeles California 
1957,Hour of Decision,Neffield Studios Middlesex England 
2017,How to Catch a Feeling and When to Let It Go,Boy Scout Camp Rd Frazier Park California exteriors 
1984,Howard Jones: Like to Get to Know You Well,High Wycombe Town Hall High Wycombe Buckinghamshire England 
1947,Hue and Cry,River Thames London England 
1953,I Love Melvin,Metro-Goldwyn-Mayer Studios - 10202 W. Washington Blvd. Culver City California 
1970,I clowns,Ostia Rome Lazio 
2015,IOCUM: The Movie,Castellón de la Plana Castellón Comunidad Valenciana 
2007,If It Ain't Stiff,Camden Town Camden London England 
1975,Il bianco il giallo il nero,Polopos Almería Andalucía 
1996,Il molo di ottobre,Torre a Mare Bari Apulia 
1955,Il segno di Venere,Pincio Rome Lazio 
2009,Imagining Love,Manchester Greater Manchester England 
1969,Imágenes del deporte Nº 8,Bilbao Vizcaya País Vasco 
2013,In Un Mondo Violento,Corato Bari Apulia 
1984,Indiana Jones and the Temple of Doom,Mooney Falls Havasupai Indian Reservation Arizona 
1969,Infanzia, vocazione e prime esperienze di Giacomo Casanova, veneziano,Infanzia vocazione e prime esperienze di Giacomo Casanova Castello Venice Veneto 
2009,Instante,Batu Caves Gombak Selangor 
2015,Intervention,2201 N Beachwood Dr. Los Angeles California 
2015,Intrusion,Ascot Berkshire England 
2010,Iron Man 2,D.C. Stages 1360 East 6th Street Downtown Los Angeles California 
2004,Isle of Skye,Scottish TV Studios Renfield Street Glasgow Strathclyde Scotland 
1994,It Could Happen to You,Trump Tower - 725 Fifth Avenue Manhattan New York City New York 
1996,J.R.R.T.: A Film Portrait of J.R.R. Tolkien,Oxford Oxfordshire England 
2005,Jack, the Last Victim,Jack England 
2013,Jan Broberg's Guide to Thespians, Sociopaths & Scream Queens,Jan Broberg's Guide to Thespians New York 
1965,Janwar,Kufri Simla Himachal Pradesh 
2013,Jasper van Kuijk: 't Kan nie op,Theater De Lievekamp Oss Noord-Brabant 
1971,Jesús, nuestro Señor,Jesús San Juan Ixtayopan Mexico City 
1980,Judaai,Annapoorna Studios Hyderabad Telangana 
2004,Juicy,Harlem Manhattan New York City New York 
2010,Justin Bieber: Baby,Mack Sennett Studios Los Angeles California 
2010,Karate Hyung of Chayon-Ryu,Chayon-Ryu World Headquarters Houston Texas 
2009,Kate Gosselin Match.Com Profile Parody,Hollywood Los Angeles California 
1991,Kaun Kare Kurbanie,Natraj Studios Mumbai Maharashtra 
1941,Keep 'Em Flying,Cal-Aero Academy Chino Airport - 7000 Merrill Avenue Chino California 
1969,Kes,Skiers Spring Colliery Broad Carr Road Hoyland South Yorkshire England 
2014,Kill the Messenger,Former Georgia Archives Building Atlanta Georgia 
2015,Knock Knock, It's Tig Notaro,Knock Knock California 
1994,Krummerne 3 - fars gode idé,Maglegårdsskolen Hellerup Sjælland 
1969,Küss mich, Monster,Küss mich Murcia 
1979,L'albero della maldicenza,Collepardo Frosinone Lazio 
1993,L'arbre, le maire et la médiathèque,L'arbre Vendée 
1973,L'insolent,Prison de la Santé - 42 Rue de la Santé Paris 14 Paris 
1991,L.A. Story,Tunnel beneath the 6th Street Viaduct Downtown Los Angeles California 
1934,La alegría que pasa,Seva Barcelona Catalonia 
1999,La carnada,Santa Rosa Chiclayo Lambayeque 
1968,La costa del Sol,Cabo de Gata Almería Andalucía 
1968,La prisonnière,8 Avenue Montaigne Paris 8 Paris 
2002,La serpiente de dos cabezas,Santa Cristina d'Aro Girona Catalonia 
1946,La tentation de Barbizon,Studios de Boulogne Avenue Jean-Baptiste Clément Boulogne-Billancourt Hauts-de-Seine 
2015,Laakhon Hain Yahan Dilwaley,Madh Island Mumbai Maharashtra 
1948,Ladri di biciclette,Citta Valmelaina Via Salaria Rome Lazio 
2010,Las imágenes perdidas. La otra mirada,Vigo Pontevedra Santiago Galicia 
2007,Lascia perdere, Johnny!,Lascia perdere Campania 
1901,Launch of Shamrock II,Dumbarton West Dunbartonshire Scotland 
1972,Le charme discret de la bourgeoisie,Rue de Franqueville Passy-La-Muette District Paris 
1976,Le corps de mon ennemi,Rue de Paris Lille Nord 
1972,Lejos de los árboles,Marín Pontevedra Galicia 
1970,Leo the Last,Cine Tele Sound Studios Ltd. London England 
2012,Les Misérables,Frithsden Beeches Hertfordshire England 
2013,Les beaux jours,Bar Européen's Pub 7 Place Charles Valentin Dunkerque Nord 
1958,Les tricheurs,Avenue des Champs-Élysées Paris 8 Paris 
2012,Letter to the Unborn,Hollywood Los Angeles California 
1991,Little Man Tate,Upham Hall Miami University Oxford Ohio 
1999,Live from the Hollywood Bowl,Hollywood Los Angeles California 
1995,Local Heroes: Baseball on Capital Region Diamonds,Yankee Stadium - E. 161st Street & River Avenue Bronx New York City New York 
1951,Locuras, tiros y mambos,Locuras Federal District 
1927,Love,Metro-Goldwyn-Mayer Studios - 10202 W. Washington Blvd. Culver City California 
1949,Lust for Gold,Lost Dutchman State Park - 6109 N. Apache Trail Apache Junction Arizona 
2013,M is for Mort, La Petite,M is for Mort Ontario 
1973,Magnum Force,Cost Plus World Market - 2552 Taylor Street San Francisco California 
1941,Mamma,Cinecittà Studios Cinecittà Rome Lazio 
1961,Man nennt es Amore,Taormina Messina Sicily 
2002,Margaret Cho: Notorious C.H.O.,The Paramount Theatre - 911 Pine Street Seattle Washington 
2004,Mean Girls,University College University of Toronto Toronto Ontario 
2002,Media Lounge 2,Hochschule der Medien Stuttgart Stuttgart Baden-Württemberg 
1969,Miradas,Donostia-San Sebastián Guipúzcoa País Vasco 
1965,Moja ulica,Twarda Wola Warsaw Mazowieckie 
2017,Moonlighter,Treasure Island San Francisco Bay California 
1996,Mrs. Santa Claus,Universal Studios - 100 Universal City Plaza Universal City California 
2011,Mugsey Goes Plough Inn,Newton Abbot Devon England 
2008,Mulheres Sexo Verdades Mentiras,Ipanema Rio de Janeiro Rio de Janeiro 
1999,Munnibai,Chandivali Studio Mumbai Maharashtra 
1946,Murder in the Music Hall,Republic Studios Hollywood Los Angeles California 
2012,Must Be a Zombie Apocalypse,Corner Brook Newfoundland Newfoundland and Labrador 
2007,My Brother & Me,Manhattan New York City New York 
1964,My Fair Lady,Stage 11 Warner Brothers Burbank Studios - 4000 Warner Boulevard Burbank California 
2009,My One and Only,Bonanza Creek Ranch - 15 Bonanza Creek Lane Santa Fe New Mexico 
2016,Mysteria,Ottersum Limburg 
1991,Nad rzeka, której nie ma,Nad rzeka Slaskie 
2008,Nancy LaMott: I'll Be Here with You,Palace Theater - 1564 Broadway Manhattan New York City New York 
2010,Nenäpäivä-show,YLE TV2 Studios Tohloppi Tampere 
1971,Nie lubie poniedzialku,Aleje Jerozolimskie Sródmiescie Warsaw Mazowieckie 
1937,Night of Mystery,Paramount Studios - 5555 Melrose Avenue Hollywood Los Angeles California 
2014,Ninja Torakage,Yabata Iga City Mie Prefecture 
2014,No Man Is an Island,Pentre Shrewsbury Shropshire 
1979,Nocturna,Brooklyn Bridge New York City New York 
1985,Obsessed with a Married Woman,YMCA 306 Loma Dr. Los Angeles California 
2004,One Perfect Day,Richmond Melbourne Victoria 
2017,One Week Later: Mars,Tamworth Staffordshire England 
2010,Oranges and Sunshine,Nottingham Nottinghamshire England 
2016,Our Kind of Traitor,Dorchester Hotel Park Lane Mayfair London England Bern 
2011,Ourhouse, Episode 2: 'Class',Ourhouse London England 
1998,Out of Sight,Universal Studios - 100 Universal City Plaza Universal City California 
2006,P.J. Harvey on Tour: Please Leave Quietly,Hammersmith Apollo Hammersmith London England 
1998,Palisades Amusement Park, a Century of Fond Memories,Palisades Amusement Park New Jersey 
1990,Paradise Lost: Live Death,Bradford West Yorkshire England 
1989,Parneviks oscarsparty,Oscarsteatern Kungsgatan Norrmalm Stockholm Stockholms län 
2015,Paul Blart: Mall Cop 2,Wynn Las Vegas - 3131 Las Vegas Blvd South Las Vegas Nevada 
2017,Phantom Thread,Blackpool Tower Ballroom Blackpool Lancashire England 
1994,Phoenix Festival,Long Marston Stratford Upon Avon England 
2012,Pick a Card, Any Card,Pick a Card Manitoba 
1958,Pigulki dla Aurelii,WFF Film Studio Wroclaw Dolnoslaskie 
1937,Pioggia d'estate,Massaciuccoli lake Lucca Tuscany 
1973,Pirineo de Huesca,Lárrede Huesca Aragón 
2011,Playmate Casting Call: The Mansion,Playboy Mansion - 10236 Charing Cross Road Holmby Hills Los Angeles California 
1946,Por tierras de Don Quijote,Lagunas de Ruidera Ciudad Real Castilla-La Mancha 
1994,Presagio - April 22, 1994,Presagio - April 22 Lombardia 
2005,Pride 29: Fists of Fire,Saitama Super Arena - 8 Shintoshin Chuo Ward Saitama City Saitama Prefecture 
2014,Prostitution: What's the Harm?,Liverpool Merseyside England 
2001,Przedwiosnie,University of Warsaw Main Campus Krakowskie Przedmiescie Sródmiescie Warsaw Mazowieckie 
2010,Psycho Ranger,Derby Derbyshire England 
1939,Quiet, Please,Quiet Burbank California 
1955,Razzia sur la chnouf,Place de l'Étoile Paris 8 Paris 
1967,Regadíos del sur,Embalse de Bembézar Hornachuelos Córdoba Andalucía 
2003,Return to Kitty Hawk: 100 Years of Flight,Wright Brothers National Monument - Route 158 Kill Devil Hills North Carolina 
1903,Review at Aldershot,Aldershot Hampshire England 
2003,Rien que du bonheur,21 rue Boulard Paris 14 Paris 
1983,Risky Business,Niles East High School - 7700 Lincoln Avenue Skokie Illinois 
2018,Rocket Club,Haleiwa O'ahu Hawaii 
1985,Romance on the Orient Express,Leeds West Yorkshire England 
2001,Rosamunde Pilcher: Blumen im Regen,Padstow Cornwall England 
1952,Royal Heritage,Hyde Park London England 
2000,Saint-Cyr,Abbaye-aux-Dames Caen Calvados 
1977,Saturday Night Fever,86th Street Brooklyn New York City New York 
2012,Savages,Rat Beach Torrance California 
2005,Schattenväter,Schauspielhaus Bochum Bochum North Rhine-Westphalia 
2001,School Killer,Tablada Guadarrama Madrid 
1964,Seance on a Wet Afternoon,Berwick Street Soho London England 
1968,Sebastian,Twickenham Film Studios St Margarets Twickenham Middlesex England 
1985,Secret Admirer,Port of Long Beach Long Beach California 
2010,Secrets of the Content,Blackheath London England 
1989,See No Evil, Hear No Evil,See No Evil NY New York 
2009,Shadow Man,Hollywood Los Angeles California 
2008,Shelter,Cheyenne Studios - 27567 Fantastic Lane Castaic California 
2016,Shoes,Los Angeles California 
2012,Shuffle,University of California Irvine California 
1944,Silent Partner,Republic Studios Hollywood Los Angeles California 
2016,Sinister Nicky,Derby Derbyshire England 
1948,Sitting Pretty,Stage 3 20th Century Fox Studios - 10201 Pico Blvd. Century City Los Angeles California 
2015,Slice,Manhattan New York City New York 
2005,Soccer of the Dead,Milton Keynes Buckinghamshire England 
